{
  "IgnoredExtensions": [".cache", ".DS_Store", ".db", ".ilcache", ".log", ".pdb"],
  "TextFileExtensions": [
    ".asax",
    ".ascx",
    ".asmx",
    ".aspx",
    ".bat",
    ".c",
    ".cmd",
    ".config",
    ".cpp",
    ".cs",
    ".cshtml",
    ".csproj",
    ".csx",
    ".css",
    ".csv",
    ".editorconfig",
    ".env",
    ".fs",
    ".fsi",
    ".fsproj",
    ".fsx",
    ".gitattributes",
    ".gitignore",
    ".gitmodules",
    ".go",
    ".gql",
    ".graphql",
    ".h",
    ".hpp",
    ".htm",
    ".html",
    ".http",
    ".ini",
    ".js",
    ".json",
    ".jsx",
    ".less",
    ".manifest",
    ".md",
    ".mod",
    ".nlog",
    ".nuspec",
    ".plist",
    ".props",
    ".ps1",
    ".psd1",
    ".psm1",
    ".py",
    ".razor",
    ".resx",
    ".rst",
    ".sass",
    ".scss",
    ".sh",
    ".sln",
    ".sql",
    ".sqlproj",
    ".sum",
    ".svg",
    ".targets",
    ".toml",
    ".ts",
    ".tsv",
    ".tsx",
    ".txt",
    ".vb",
    ".vbproj",
    ".vue",
    ".xaml",
    ".xml",
    ".yaml",
    ".yml"
  ],
  "MaxLogGenerations": 5,
  "ShouldIncludeUnchangedFiles": true,
  "ShouldIncludeIgnoredFiles": true,
  "ShouldOutputILText": true,
  "ShouldIgnoreILLinesContainingConfiguredStrings": false,
  "ILIgnoreLineContainingStrings": [],
  "ShouldOutputFileTimestamps": true,
  "MaxParallelism": 0,
  "TextDiffParallelThresholdKilobytes": 512,
  "TextDiffChunkSizeKilobytes": 64,
  "EnableILCache": true,
  "ILCacheDirectoryAbsolutePath": "",
  "ILCacheStatsLogIntervalSeconds": 60,
  "ILCacheMaxDiskFileCount": 1000,
  "ILCacheMaxDiskMegabytes": 512,
  "OptimizeForNetworkShares": false,
  "AutoDetectNetworkShares": true
}
